[
    {
        "demanda_id":  "DLG-20260528-101",
        "data_registro":  "2026-05-28T12:00:00Z",
        "origem_principal":  "usuario",
        "demanda_bruta":  "Quero organizar prioridades semanais de atendimento com criterio claro.",
        "status":  "capturado",
        "titulo_curto":  "Prioridades semanais atendimento",
        "responsavel_triagem":  "time-dlogica",
        "contexto_inicial":  "Operacao com reclamacoes de atraso",
        "restricoes_iniciais":  [
                                    "Sem app novo na fase 1",
                                    "Manter fluxo simples"
                                ],
        "observacoes":  "Caso de validacao do modulo 1."
    },
    {
        "demanda_id":  "DLG-20260528-APP01",
        "data_registro":  "2026-05-28T20:30:00Z",
        "origem_principal":  "usuario",
        "demanda_bruta":  "Preciso de um app para centralizar demandas recorrentes com fluxo repetivel validado.",
        "status":  "capturado"
    },
    {
        "demanda_id":  "DLG-E2E-20260528-001",
        "data_registro":  "2026-05-28T22:00:00Z",
        "origem_principal":  "usuario",
        "demanda_bruta":  "Preciso reduzir retrabalho operacional com uma rotina clara de priorizacao semanal.",
        "status":  "capturado",
        "titulo_curto":  "Reduzir retrabalho operacional",
        "responsavel_triagem":  "time-dlogica",
        "contexto_inicial":  "Operacao com fila de tarefas criticas sem dono claro"
    }
]
