{
  "demanda_id": "DLG-20260528-101",
  "data_registro": "2026-05-28T12:00:00Z",
  "origem_principal": "usuario",
  "demanda_bruta": "Quero organizar prioridades semanais de atendimento com criterio claro.",
  "status": "capturado",
  "titulo_curto": "Prioridades semanais atendimento",
  "responsavel_triagem": "time-dlogica",
  "contexto_inicial": "Operacao com reclamacoes de atraso",
  "restricoes_iniciais": [
    "Sem app novo na fase 1",
    "Manter fluxo simples"
  ],
  "observacoes": "Caso de validacao do modulo 1."
}
